issuer_name,standardized_issuer_name,issuer_group,ownership_type,sector,sub_sector,mapping_confidence,mapping_source,remarks
LIC HOUSING FINANCE LIMITED,LIC HOUSING FINANCE LIMITED,LIC Group,Government-linked listed subsidiary,Financial Services,Housing Finance,Medium,https://stockanalysis.com/quote/nse/LICHSGFIN/company/,LIC Housing Finance provides housing finance; parent/group mapping to LIC should be verified from latest annual report before final paper tables
NATIONAL BANK FOR AGRICULTURE AND RURAL DEVELOPMENT,NATIONAL BANK FOR AGRICULTURE AND RURAL DEVELOPMENT,Government of India / NABARD,Statutory development financial institution,Financial Institution,Development Finance,High,https://www.nabard.org/,NABARD is treated as government-linked development finance institution; exact statutory ownership language to verify from annual report
REC LIMITED,REC LIMITED,PFC-REC Group,Government-linked PSU / power-sector financier,Financial Services,Infrastructure Finance - Power,High,https://www.recindia.nic.in/,REC is a government-linked power-sector financier; 2026 sources indicate PFC acquired government stake, so group classification should be reviewed if final sample date is after acquisition
SMALL INDUSTRIES DEVELOPMENT BANK OF INDIA,SMALL INDUSTRIES DEVELOPMENT BANK OF INDIA,SIDBI,Government-linked development financial institution,Financial Institution,MSME Development Finance,High,https://www.sidbi.in/en/about#financials-shareholding,SIDBI shares are held by Government of India and other central-government-owned or controlled institutions
NATIONAL HOUSING BANK,NATIONAL HOUSING BANK,National Housing Bank,Government-owned financial institution,Financial Institution,Housing Finance Regulator / Development Finance,Medium,https://nhb.org.in/,Treat as government-linked; verify ownership and legal status from latest annual report
NTPC LIMITED,NTPC LIMITED,NTPC Group,Central public sector enterprise,Utilities,Power Generation,High,https://www.ntpc.co.in/index.php/ntpc-overview,NTPC is classified as Maharatna CPSE under Ministry of Power; Government of India majority stake noted in public company overview
POWER FINANCE CORPORATION LIMITED,POWER FINANCE CORPORATION LIMITED,PFC-REC Group,Government-linked PSU / power-sector financier,Financial Services,Infrastructure Finance - Power,High,https://www.pfcindia.com/,PFC is a government-linked infrastructure finance company focused on the power sector; group includes REC subject to final sample date
INDIAN RAILWAY FINANCE CORPORATION LIMITED,INDIAN RAILWAY FINANCE CORPORATION LIMITED,Indian Railways / Government of India,Central public sector enterprise,Financial Services,Railway Infrastructure Finance,High,https://irfc.co.in/,IRFC is treated as a Government of India railway finance PSU under Ministry of Railways
INDIAN OIL CORPORATION LIMITED,INDIAN OIL CORPORATION LIMITED,Indian Oil Group,Central public sector enterprise,Energy,Oil and Gas,High,https://iocl.com/,Indian Oil is treated as a Government of India linked oil and gas PSU; latest ownership should be verified from shareholding pattern
